Label,Tweet,,,,,,,,,,,,,,,,,,
HS,Anak pecun... ga jauh1 dr hobi zina.. haha,,,,,,,,,,,,,,,,,,
HS,GILA MENTANG MENTANG DAH BUKAN ANAK SMA,,,,,,,,,,,,,,,,,,
HS,ya lu bacot bngst,,,,,,,,,,,,,,,,,,
HS,"Asw, serem sumpah udah pernah nyari tau apa gitu",,,,,,,,,,,,,,,,,,
HS,Sama anjir mangkanya gua on disini mulu,,,,,,,,,,,,,,,,,,
HS,blur kampret,,,,,,,,,,,,,,,,,,
HS,Yeuh kunyuk,,,,,,,,,,,,,,,,,,
HS,Susu monyet liar yee,,,,,,,,,,,,,,,,,,
HS,KENAPA BOLOT,,,,,,,,,,,,,,,,,,
HS,woy goblog gw ngakak=)),,,,,,,,,,,,,,,,,,
HS,Babi jgn diingatkan hahhahah,,,,,,,,,,,,,,,,,,
HS,bodo mamat gue ngambek bodo mamat gue ngambek ,,,,,,,,,,,,,,,,,,
HS,"Loe Bong ga denger jeritan Petani??ga denger jeritan Petani Garam?? Apa jgn loe BOLOT akut??...pemerataan apa yang loe maksud Bong?? Gw mohon dgn sangat,,segeralah Bersihin Kerak Otak Lumpur Loe yang sudah mengeras Bong",,,,,,,,,,,,,,,,,,
HS,Lu tanya bank duniaOtak onta sih luDongok malas bego tolol ya itu onta,,,,,,,,,,,,,,,,,,
HS,Memek mulus,,,,,,,,,,,,,,,,,,
HS,apa? vin? gimana gimana? mata gue budek gabisa baca,,,,,,,,,,,,,,,,,,
HS,Amit amit jabang bayi dopinadoh minggato setan gombel setan banci sko TL,,,,,,,,,,,,,,,,,,
HS,"Dia bodoh gila, pi baca tweet1 dia semua masalah sial",,,,,,,,,,,,,,,,,,
HS,"kalau kualitasnya gini jangankan bayar nanti 20 Mar, gratis pun mending pake antena nonton di Indos*ar  ",,,,,,,,,,,,,,,,,,
HS,00 GB raib dicuri oleh providernya sendiri kan kampret,,,,,,,,,,,,,,,,,,
HS,Ngomong gak diatur. Bodo apa pikun? Kurang literasi nih pak jenderal. Lha wong bibib kena kasus menghina pancasila kok katanya paham sekali.Mabuk kecubung nih orang,,,,,,,,,,,,,,,,,,
HS,Dua orang sarap klo disatuin gimana jadinyaa cobaaak,,,,,,,,,,,,,,,,,,
HS,Babi tu makhluk Allah..,,,,,,,,,,,,,,,,,,
HS,anda lebih TOLOL,,,,,,,,,,,,,,,,,,
HS,pernah naek atas monas? gila hebat,,,,,,,,,,,,,,,,,,
HS,"""Musik milenial emang sampah, mending dibilang tua daripada jadi (indie idiot)""..Maksud km indie disini apa ? Musik modern ?Indie itu berasal dari musik independent bro.. dalam artian musisi tersebut tidak mnggntung nasib pada fihak lain(mandiri).Musisi old udh indie sejak dulu",,,,,,,,,,,,,,,,,,
HS,Selera musikmu modern? Playlist lebih banyak lagu terkini?Tapi takut dibilang anak indie idiot sama netizen?Ngapain insecure? Musik jadul emang sampahMending dibilang anak indie idiotDaripada jadi anak jadul tapi idiot,,,,,,,,,,,,,,,,,,
HS,mereka emang punya masa kelam tapi mereka sinting klo bilang culture mereka bnyk ditiru krn utk membuka luka lama atau menista mksd nya kan sebagian malah appreciate budaya itusure gue ga habis pikirgue blok juga lama1 orang1 itu,,,,,,,,,,,,,,,,,,
HS,"memek ,, eh mewek ",,,,,,,,,,,,,,,,,,
HS,"Kenapa sampai ada cacing pita dalam sarden ,,taugak sarden itu dikemas dalam wadah seng untuk pengawet seng iti yang paling murah ya itu menyak babi",,,,,,,,,,,,,,,,,,
HS,: brengsek lama1 tri ini. Aplikasi bima tri jgn dihapus knapa sih???,,,,,,,,,,,,,,,,,,
HS,kebanyakan alasan...si banci bloon itu cuma TAKUT MALU... ,,,,,,,,,,,,,,,,,,
HS,zonkey hanyalah seekor banci planga plongo...,,,,,,,,,,,,,,,,,,
HS,dasar tolol.,,,,,,,,,,,,,,,,,,
HS,"anjir.....gue ngecek berkali kali buat mastiin itu cewe beneran apa cowo, siapa tau tipuan kaya video yang lain, ternyata asli cewe terlepas dari gender, tetep gabener sih astaga semoga ade gue ga begini, aamiin.",,,,,,,,,,,,,,,,,,
HS,asw gua ketawa,,,,,,,,,,,,,,,,,,
HS,Bacot la njer. Sok intelek. Kek telek,,,,,,,,,,,,,,,,,,
HS,Dari awal sebelum filmnya tayang juga udah gak boleh spoiler!!!!!BACOT ANJENG,,,,,,,,,,,,,,,,,,
HS,"Giliran diperingatin sama pelayan jogernya, baru mau mundur. Mana bikin barisan sendiri banyak banget lagi. Tolol.",,,,,,,,,,,,,,,,,,
HS,kirain orang-orang kayak gini cuma karangan fiksi anjir,,,,,,,,,,,,,,,,,,
HS,Anjir kata kata guhe,,,,,,,,,,,,,,,,,,
HS,"Satu bukti valid lagi, bahaya virus idiot yang diminum oleh (salah satunya) admin bisa membuat otak berhenti bekerja saat mulut bicara atau jari menekan keyboard komputer.",,,,,,,,,,,,,,,,,,
HS,"[Fakta Ve]Ve dulu punya anjing, namanya juno dan bruno. Tapi sekarang karena udah besar, jadi anjingnya dipindahin ke rumah kakeknya.",,,,,,,,,,,,,,,,,,
HS,Maju lu sini anjing ni stail ah lepastu orang tu reply gung gung gung gunggg,,,,,,,,,,,,,,,,,,
HS,pengetahuan tidak dapat menggatikan persahabatan. aku lebih suka jadi orang idiot daripada harus kehilanganmu (spongebob).patrick,,,,,,,,,,,,,,,,,,
HS,Para Bajingan yang telah melukai Lady harus menerima ganjaran seratus kali lipat!!,,,,,,,,,,,,,,,,,,
HS,dan homo jadi mau tidak mau saya pun merasa harus membuktikan kalau saya tidak banci ke orang-orang namun sepertinya gagal karena banyak faktor apalagi dengan wajah saya yang bisa dibilang terlalu manis. Kedoyanan para wanita untuk di uwel-uwel. ,,,,,,,,,,,,,,,,,,
HS,0 kata buat lo!! BAJINGAN,,,,,,,,,,,,,,,,,,
HS,"0. manusia terkaga jelas ntu dia, sabar banget ngadepin gua wkwk, idiot garis keras, suka ngambek kg jelas, kdg nethink, kg suka dikacangin, moody kdg, ngambek e bentar doang, kaga pernah jelas ribut sama dia, bullyable, bocah dari segala bocah ya, dia.",,,,,,,,,,,,,,,,,,
HS,"10. Jipepet ngeselin pisan anaknya. Baik kdang1, suka bener ama monyet. Cowonya segambreng caileh",,,,,,,,,,,,,,,,,,
HS,"14 jam kedepan pengen buta, budek aja gamau percaya apa apa sip!",,,,,,,,,,,,,,,,,,
HS,"6911.Wedeeeh ini mah udah ky brother from another meki . HAHAHAHAHAH ngocol anjing ni anak g paham lg gua . Tiap"" chatan ketawa mulu gua dibuatnya ampe sakit perut . Baik banget, open minded, friendly, kocak, sampah, idiot, demen ngentot. yang ada dipikirannya itu memek,memek mulu",,,,,,,,,,,,,,,,,,
HS,8 bulan ga ketemu matematika di HI gue jadi goblok banget gitu,,,,,,,,,,,,,,,,,,
HS,"98. Sebenernya gw ogah temenan ama lu di rl rp Ga anjing gw bercanda jan nangis lagi wkwk. Gatau, lu orangnya bikin gw banyak bacot. Udah si itu ae wkwk",,,,,,,,,,,,,,,,,,
HS,ada bahan baru buat dibahas buat 5 tahun kedepan...bukan showtime doang bukan acara yang ada 2 makhluk kampret dan yang dihebohin fans duabelas sinting...,,,,,,,,,,,,,,,,,,
HS,ada yang mau kirim foto kontol gak nich,,,,,,,,,,,,,,,,,,
HS,"tapi ga apa para kampret mah gampang dibegoin, dulu jg pernah bilang ditutup eh masih exis tuh alexis...",,,,,,,,,,,,,,,,,,
HS,Adaloh orang yang suka nyinyirin pecun di timeline tapi ngelike postingan akun open BO. ,,,,,,,,,,,,,,,,,,
HS,"admin kok dendaman, gausa jd admin tolol",,,,,,,,,,,,,,,,,,
HS,Admin tolol di partai tololPartai Tolol untuk orang Tolol,,,,,,,,,,,,,,,,,,
HS,Ah tai lah,,,,,,,,,,,,,,,,,,
HS,"Akhirnya dapet pencerahan jg soal Adora-Hilman-Alina. Too complicated, tapi faker emang bener ada sih di rl, emg nyatanya ada kok yang seniat itu buat jd faker. Gila gasi. Gapaham sih kenapa mesti jd faker gt? Apa sbnrnya doi penyuka sesama jenis yang show off gt? Apa gmnsi:(",,,,,,,,,,,,,,,,,,
HS,"Akibat pilek, bindeng.. kuping berasa budek ",,,,,,,,,,,,,,,,,,
HS,AKU HBS PULANG SKILLAB HBS PUYENG KRN AKU BUDEK GABISA BEDAIN SUARA REDUP JANTUNG PAS DIPALPASI ITU GMN SEMUA TERASA SAMA DIKUPINGKU TRS PAS PULANG LIAT TL W0 TERNYATA JADI KONSER AKU MAKIN POSENG.,,,,,,,,,,,,,,,,,,
HS,"aku ingin menjadi bagian dari dirimu, walaupun itu hanya setitik tai lalat di tubuhmu.",,,,,,,,,,,,,,,,,,
HS,Aku juga suka melakukan hal idiot bareng oppa,,,,,,,,,,,,,,,,,,
HS,"Aku nggak bisa ngebayangin gimana perasaan mbaknya yang udah baik-baik memberitau kalo beliau itu ""disabilitas"" kok malah dibales. ""Mati aja lu"". Bajingan",,,,,,,,,,,,,,,,,,
HS,Aku selalu buat keputusan terus dari hati aku terus cakap . Tu kekadang mcm bodo tah lah,,,,,,,,,,,,,,,,,,
HS,Aku suda delete tu post baru para bajingan tu online,,,,,,,,,,,,,,,,,,
HS,Aku syak jerawat ni spesis fans chelsea lah suka tumbuh dekat dalam hidung ala ala gua gitu. Dah 1008 move on lu jerawat. Tumbuh aja dimana ya terserah yang penting bukan di hidung ya setan budek.,,,,,,,,,,,,,,,,,,
HS,Aku tg di rp ga pernah ngaku ngaku ntg ya sori harusnya rangorang jg nyadar typing aing banci gini masih aja ada yang naksir/dicemburuin hdh,,,,,,,,,,,,,,,,,,
HS,Akutu ndabisa kalo kamutu Sssst bacot,,,,,,,,,,,,,,,,,,
HS,Amerika Latin gila tiket Piala Dunia ,,,,,,,,,,,,,,,,,,
HS,ANJING GOBLOG SETAN BANGSAT!!!!!!!!!!,,,,,,,,,,,,,,,,,,
HS,Anjir abis bersin malah budeh ampe skrg:(,,,,,,,,,,,,,,,,,,
HS,anjir ini mati listrik sepulau namanya euy,,,,,,,,,,,,,,,,,,
HS,anjir tertipu lagi!!,,,,,,,,,,,,,,,,,,
HS,antabur adalah ancuran tai burung,,,,,,,,,,,,,,,,,,
HS,Apa boleh aku simpulkan.Akhirnya semua pada CUCI TANGAN mencari selamat Sendiri?...Kalo ya..BRENGSEK... ,,,,,,,,,,,,,,,,,,
HS,Apa hubungannya ANAK LAYANGAN dengan KAMPUNGAN Gan ??!,,,,,,,,,,,,,,,,,,
HS,"Apabila setan membisikkan was-was kepadamu, mintalah perlindungan kepada Allah.",,,,,,,,,,,,,,,,,,
HS,Apasal laa aku rindu. Eeeee.. Idiot betul laa,,,,,,,,,,,,,,,,,,
HS,Ari sarua beki mah repeh monyet,,,,,,,,,,,,,,,,,,
HS,Artis kalo adalnya dari Kampung mau di gimanain juga tetap Aja Udik/Kampungan!! Sgala HP anak gue lah di Cemplungin!! Gue beli pake Kringat Halal!! bukan Hasil Ngangkangin laki Org!!,,,,,,,,,,,,,,,,,,
HS,Assalamualaikum Bu Risma tolong warga sya di jalan Kalimas udik 0c dpan rumah jl Kalimas udik 0b/0 minta bantuan dari Bu risma. Warga sya rumahnya roboh kshan Bu Risma warga sya gak Punya tempat tinggal rumahnya roboh.,,,,,,,,,,,,,,,,,,
HS,Asw ini 00:45 lho dan skrg ngantuk.,,,,,,,,,,,,,,,,,,
HS,"Asw ya tapi gua jarang ngambek, tacut wkkwkwkwkw gua kan bucin.",,,,,,,,,,,,,,,,,,
HS,Awas aja kalo puisi sukmawati dipake senjata berpolitik. Udik.,,,,,,,,,,,,,,,,,,
HS,Babap tai.Sampai bertemu nanti bapMun uing cageur ,,,,,,,,,,,,,,,,,,
HS,babi apaa sialll,,,,,,,,,,,,,,,,,,
HS,Babi betul meeting sampai 4jam sakit pinggang aku,,,,,,,,,,,,,,,,,,
HS,Bacot ni pecun ,,,,,,,,,,,,,,,,,,
HS,"Bagaimana dengan kalimat, ""aku selalu ada buat kamu""JANGAN BACOT DOANG, BUKTIIN.Tapi akan lebih baik kalau kalimatnya dibuat seperti ini,""Maaf kalau aku engga bisa kasih solusi apa-apa, kalau kamu butuh aku dan aku bisa, aku pasti ada buat kamu""",,,,,,,,,,,,,,,,,,
HS,Bajingan punya line,,,,,,,,,,,,,,,,,,
HS,Bajingan rampok dong.. rakyat sj yang menghakimi ,,,,,,,,,,,,,,,,,,
HS,"Bajingan sekali kok drivernya itu. Sorry nggak pantes disebut driver, karena driver sifatnya universal. Kasihan yang lain yang udah kerja bener nanti kena, kita ganti selanjuttnya jadi bangsat aja",,,,,,,,,,,,,,,,,,
HS,"Bajingan...bangsat... lo bukan siapa-siapa, kok sombong banget!!!!",,,,,,,,,,,,,,,,,,
HS,banci anjr wkwkwk ,,,,,,,,,,,,,,,,,,
HS,Banci lu ga berani bales lagi dasar penakut bruakakakak :D,,,,,,,,,,,,,,,,,,
HS,bangga ye pacaran sama bekas gw?hahahaha buat gw mantan kaya tai gitu ibarat maenan bekas yang udah ga kepake sama sekali! ckckck,,,,,,,,,,,,,,,,,,
HS,Bangke sampe kg bsa tidur siang :(,,,,,,,,,,,,,,,,,,
HS,Bangke. Gak dijual nih acc,,,,,,,,,,,,,,,,,,
HS,Bangke. Gua udh bangun pagi malah masuk siang,,,,,,,,,,,,,,,,,,
HS,Bangke. Nemu aja orang-orang yang bisa bikin ngakak di Twitter.,,,,,,,,,,,,,,,,,,
HS,banyak banget lelaki brengsek di dunia inimudah1an kamu gak termasuk ya ,,,,,,,,,,,,,,,,,,
HS,"Banyak banget yang blum disebutin,Dan lucunyaMASA SAYA DITUNTUT UNTUK SENANG!(Cm orang sinting yang brfikir bwgitu)",,,,,,,,,,,,,,,,,,
HS,Bawang putih dapat meracuni anjing dan kucing.,,,,,,,,,,,,,,,,,,
HS,Beberapa pengguna Buah Iblis membutuhkan waktu dan latihan untuk memaksimalkan potensi kekuatan mereka,,,,,,,,,,,,,,,,,,
HS,Bekasi panasnya sinting !,,,,,,,,,,,,,,,,,,
HS,"Belajarlah dari BABI NGEPET, kalau malam cuma pakai lilin ",,,,,,,,,,,,,,,,,,
HS,Belum cukuran bulu memek ni,,,,,,,,,,,,,,,,,,
HS,Bembem paling kampret memang *ngakak sampe besok* ,,,,,,,,,,,,,,,,,,
HS,bisa sinting sih lama lama waw. ,,,,,,,,,,,,,,,,,,
HS,"Bodo ah, males buat pacaran. Gue yang jomblo napa lu yang repot.",,,,,,,,,,,,,,,,,,
HS,Bodo amat bego.,,,,,,,,,,,,,,,,,,
HS,BODO AMAT BNGS GUE LAGI UAS ,,,,,,,,,,,,,,,,,,
HS,bodo amat mentab gua gak terselamatkan,,,,,,,,,,,,,,,,,,
HS,Bodo fake haram,,,,,,,,,,,,,,,,,,
HS,"bodo menyampah aku baca semua rumours pasal transfer window nanti. baik cakap je senang ""SEMUA PLAYER STAR , STRIKER POWER , MID POWER , DEF POWER SEDANG DIBURU OLEH MANCHESTER UNITED. CLUB LAIN BOLE PERGI MAIN JAUH1 SEBAB MENYU NAK KUMPUL SMUA STAR DLM CLUB. SEKIAN kepala bana.",,,,,,,,,,,,,,,,,,
HS,"bodo perangai tak matang langsung, ingatkan dah besar ni perangai berubah dah",,,,,,,,,,,,,,,,,,
HS,Bodoh banget sihh..Udah tahu gak bakalan di jawab!Malah tanya terus..Bodoh apa goblok itu sodaraan ya.Yasudah lah.. Nama juga hidup..Makasih yaa,,,,,,,,,,,,,,,,,,
HS,Bodohnya cerita TAK ADA CINTA SEPERTIMU ni. Tolol amat,,,,,,,,,,,,,,,,,,
HS,Boleh bodo tgk taik manusia ni ,,,,,,,,,,,,,,,,,,
HS,Bolot atau emang kagak nyambung? ,,,,,,,,,,,,,,,,,,
HS,bolot dong sis ,,,,,,,,,,,,,,,,,,
HS,brengsek anjeng yut ga gini dong ah gila ,,,,,,,,,,,,,,,,,,
HS,Brengsek anjirittt siaaaaallllllll aku benciiiiiiiiiiiiiiiiiiiii jahaaaaaaaaaaatttttttt,,,,,,,,,,,,,,,,,,
HS,BRENGSEK BAJINGAN GIMANA SIH GAK WARAS GUE ASTAGHFIRULLAH!!! ,,,,,,,,,,,,,,,,,,
HS,BRENGSEK BANGET SIH PUNYA MEMBER ,,,,,,,,,,,,,,,,,,
HS,Brengsek gue udah nanges liat dk jd goblen:( ,,,,,,,,,,,,,,,,,,
HS,BRENGSEK GW BR LIAT ANJEEEENG FIX BGT GUE PINGSAN DULU BYE ,,,,,,,,,,,,,,,,,,
HS,Brengsek itu bukan di liat dari ganteng/cantiknya orang tersebut! Skrg aja yang jelek-jelek pada sok laku. *miris*,,,,,,,,,,,,,,,,,,
HS,Brengsek lagunya mantaaapppp!! ,,,,,,,,,,,,,,,,,,
HS,Brengsek nih auto correct gwa baru sadar,,,,,,,,,,,,,,,,,,
HS,Brengsek nih hp di cas td sore gak mau penuh penuh juga batre nya,,,,,,,,,,,,,,,,,,
HS,Brengsek. 1 jam setengah yang memuaskan. Taik lah keren bet ni film :)) ,,,,,,,,,,,,,,,,,,
HS,"Buat cewe nih! Jangan tolol deh cuma gara1 cinta, lo sampe rela ngasih kehormatan lo",,,,,,,,,,,,,,,,,,
HS,"Buat orang yang duduk 5 deret sebelah kiri gue di C07, mungkin C10-C15, Planet Hollywood, Gatsu. Kalian kampungan asli.Komen mulu sepanjang film.",,,,,,,,,,,,,,,,,,
HS,budek anjir ,,,,,,,,,,,,,,,,,,
HS,"Buka youtube beberapa hari ini, nongolnya video ttg Lucinta Luna mulu, siapa sih? Mau nonton/browsing males, kayaknya sih bencong.",,,,,,,,,,,,,,,,,,
HS,"Bukan hanya anjing, babi pun demikian. Monggo jika berkenan",,,,,,,,,,,,,,,,,,
HS,"BULGARIAKAMIS, 19/02/08A.I : 9*0*7KPL : 1*5*6*0EKR : 7*4*0*21D : 10*79*85*46*20*09*26*78*15*94*00*58*MACAU : 69*02CB : 6*5SHIO : MONYET ",,,,,,,,,,,,,,,,,,
HS,cakep ya monyet nya ,,,,,,,,,,,,,,,,,,
HS,Capek gue kayak ngerasa bego sendiri di antara temen1 gue yang diskusi buat ujian ,,,,,,,,,,,,,,,,,,
HS,"cc: kaum bumi datar, sumbu pendek, cebong cebong kampret, dan teman-temannya!! ",,,,,,,,,,,,,,,,,,
HS,CERITA &amp,,,,,,,,,,,,,,,,,,
HS,cewe itu gak selama nya bisa sabar ngadepin kelakukan bajingan laki-laki,,,,,,,,,,,,,,,,,,
HS,"Cewek1 bilang: semua cowok itu brengsek. tapi mereka salah. gue bukan tipe cowok brengsek, tapi gue COWOK BAJINGAN. :p",,,,,,,,,,,,,,,,,,
HS,Chaser top Jogja mana aja NIH ?,,,,,,,,,,,,,,,,,,
HS,Chelsea sampah sarap,,,,,,,,,,,,,,,,,,
HS,"cinta itu buta, buta itu gelap, gelap itu hitam, hitam itu monyet, monyet itu yang baca tweet ini.",,,,,,,,,,,,,,,,,,
HS,Cinta itu buta.. Tapi ga budek.. Tau mana suara motor dan suara mobil.. Apalagi mobil sport ,,,,,,,,,,,,,,,,,,
HS,Coba itu yang suka ngatain kpop banci tapi heboh kalo ngomongin drakor mana ? Maap maap aja ya nih mas mba Drakor yang lo pada sering tonton itu beberapa ada yang jadi idol loh,,,,,,,,,,,,,,,,,,
HS,Cowo brengsek semua ya,,,,,,,,,,,,,,,,,,
HS,cowo kalo lg ngentot kok ganteng bgt ya haha,,,,,,,,,,,,,,,,,,
HS,Cowo kalo ngambek bisa ampe berhari hari ya? asw jddnjdjdej galau genk,,,,,,,,,,,,,,,,,,
HS,Cowo yang hobi selfie itu ga ada beda ny sama lekong &amp,,,,,,,,,,,,,,,,,,
HS,Cowok itu cma ada 1 macem kalok gx bajingan ya banci (raditia dika) tp knapa ya cewek tetep suka sama bajingan ????,,,,,,,,,,,,,,,,,,
HS,"Cuba la tgk anime ni, Karakai Jozu No Takagi-san, kalau rasa nak feeling feeling cinta monyet zaman sekolah..memang throwback habes..",,,,,,,,,,,,,,,,,,
HS,Cuk bangun mau bubur tai ayam ga?!,,,,,,,,,,,,,,,,,,
HS,Cuma cowok brengsek &amp,,,,,,,,,,,,,,,,,,
HS,Dalam praktek pannage peternak memberikan satu atau dua ekor babi sebagai bayaran untuk tuan tanah.,,,,,,,,,,,,,,,,,,
HS,"Dan engaku malah party sana sini, tak berhenti seperti cinta ku kepadamu tak pernah berarti. Bajingan",,,,,,,,,,,,,,,,,,
HS,"Dan seorang gadis, meski sudah berada di benaknya selama beberapa bulan terakhir, menghantui pikiran seperti bayangan gelap (namun yang satu ini justru bikin senang), tidak boleh menghancurkan mimpinya.Bolehlah orang mengatainya bajingan, brengsek.",,,,,,,,,,,,,,,,,,
HS,dari dulu kenapa bapak w kalau ke mantan mantan w selalu mgerasa sedih ampe kepikiran dan gabisa tidur lohh?!! dan w ngerasa jadi anak yang brengsek aja gt ke laki1 :))),,,,,,,,,,,,,,,,,,
HS,"Daripada bacot ini itu dan menyakiti orang lain, mending bercermin.",,,,,,,,,,,,,,,,,,
HS,Daya tarik utama mengkonsumsi Buah Iblis adalah kemampuan khusus yang akan diperoleh setelahnya,,,,,,,,,,,,,,,,,,
HS,"Desa, atau udik, menurut definisi ""universal"", adalah sebuah aglomerasi permukiman di area perdesaan (rural). Di Indonesia,",,,,,,,,,,,,,,,,,,
HS,Detik ini juga membuktikanLu lelaki BAJINGAN,,,,,,,,,,,,,,,,,,
HS,"Di grup wa kantor, ad yang posting bude sumiyati. Di ig story temen jg. Jadi notice kan. Apaan sih ini. Trus kepo liat profilnya. Anjir.. koplak",,,,,,,,,,,,,,,,,,
HS,di indonesia kalau marah emosi pengen gebukin bilang tolol kalau arab saudi malah senang dibilang tolol bahkan buat bisnis besar karena terdengar seperti talal,,,,,,,,,,,,,,,,,,
HS,"Di Twitter, cewek1 yang bisa di BO bnyak yang ga berkualitas, foto dan kenyataan jauh beda, harga mahal service jg ga bagus1 amat,,,Ini gua bisa bilang karena udah pengalaman bo puluhan kali, puluhan perek, tanpa dpt hasil yang memuaskan.",,,,,,,,,,,,,,,,,,
HS,"Dia hanya Teman Mainku Sewaktu Kecil dan Cinta Demikian Tidak Masuk Kedalam Hati, Kata Orang Cinta Seperti ini adalah Cinta Monyet.",,,,,,,,,,,,,,,,,,
HS,"Dia memang tidak punya hak untuk berkata seperti itu, tapi tidak ada salahnya untuk melindungi kan?Panji hanya ingin menyampaikan pesan dan satu pertanyaan. Dev, baik-baik ya kamu, semoga cowo yang deketin kamu gak brengsek, aku gak mau kamu sakit Dev, kita ini apa? ",,,,,,,,,,,,,,,,,,
HS,Dia takut banci tapi :( ,,,,,,,,,,,,,,,,,,
HS,"dih! Ngaku lebih pinter dr orang politik, NGACA DULU WOYY tampang loe aja  orang BEGO!!! ckakakakak",,,,,,,,,,,,,,,,,,
HS,Dimampusin aja udah tuh kunyuk penyembah lembu ,,,,,,,,,,,,,,,,,,
HS,"Disebut Kampungan Oleh Nagita Slavina, Begini Reaksi Ayu Ting Ting ",,,,,,,,,,,,,,,,,,
HS,"Disebut Norak Dan Kampungan Oleh Nagita Slavina, Ibunda Ayu Ting Ting Doakan Hal Ini! ",,,,,,,,,,,,,,,,,,
HS,Dm gua ga dibales. Tai pulsa ilang woy 70r,,,,,,,,,,,,,,,,,,
HS,Donatur 101....adalah bajingan ,,,,,,,,,,,,,,,,,,
HS,Dulu dia yang takut aku tinggalkan dia last last dia yang tinggalkan aku babi apa,,,,,,,,,,,,,,,,,,
HS,"Dulu pas baru jadian. eh tau gak, gue gak pernah dapetin cwek senyaman loe. Gue janji bakal gak ninggalin loe. MASA??? (BODO)""terus dalam hati gue ngomong, gak pernah senyaman gue loe pernah pcran brtahun*,dan loe ninggalin doi. ",,,,,,,,,,,,,,,,,,
HS,"Dulu, seumur hidup gue gak pernah ngeliat kecoa terbang. Beberapa lama kemudian, untuk pertama kalinya gue liat kecoa terbang di depan mata gue. Dan semenjak itu gue jadi sering ngeliat kecoa terbang. Dan gue takut kalo mereka terbang. Bangke.",,,,,,,,,,,,,,,,,,
HS,dya pintar klaw lgy bego,,,,,,,,,,,,,,,,,,
HS,EANJINK AWAS AJA SAMPE SI BIRU1 ITU BAWA ORANG KE BACKSTAGE GUA SLEPET PAKE AHGABONG BODO,,,,,,,,,,,,,,,,,,
HS,"Eh kiapa so stalking1 Dilan milea ini, bajingan",,,,,,,,,,,,,,,,,,
HS,Eh kunyuk ,,,,,,,,,,,,,,,,,,
HS,"eh sori bangetnih Milton J Bennet, lu ngapain punya S2 kalo cuma mau bilang ""simpati sama empati sama sama penting"" goblok",,,,,,,,,,,,,,,,,,
HS,Ejekan Monyet Kembali Mencemari Bola Sepak ,,,,,,,,,,,,,,,,,,
HS,"Emang kalo mau PACARAN harus punya PACAR dulu ya? Terus, kalo kita mau SARAPAN harus jadi SARAP dulu, gitu?",,,,,,,,,,,,,,,,,,
HS,emang ya anjir kalo ke songgoriti naik motor berdua cewek cowok langsung ditawarin villa.,,,,,,,,,,,,,,,,,,
HS,"Emg susah yah kalau Club sama Supporternya Gak Pnya Mental, pasti dikit* lapor polisi.",,,,,,,,,,,,,,,,,,
HS,"Emyu mau kedatangan pemain asal Arab. Biar berkah kayaknya. Kan udah lambangnya setan, dukung LGBT lagi. Jadinya harus diseimbangkan.",,,,,,,,,,,,,,,,,,
HS,"Fb tai anjing lah,",,,,,,,,,,,,,,,,,,
HS,FIFA siasat isu,,,,,,,,,,,,,,,,,,
HS,suara monyet aksi Perancis-Russia ,,,,,,,,,,,,,,,,,,
HS,"Foto sekilas ngentot ibu kandung gue tadi malam, sengaja gue kasih sekilas dulu, mau liat respon anda semua, 000 Retwet gue kasih foto Waktu ngentot yang full body ",,,,,,,,,,,,,,,,,,
HS,"FUCK YOU CEWE IBLIS LU TUH TOLOL, CUMAN GUE BOHONGIN DOANG! USER",,,,,,,,,,,,,,,,,,
HS,Ga kuat ngadepin bacot ibu ibu. Sumpah gakuat.,,,,,,,,,,,,,,,,,,
HS,Gak enak bego dituduh-tuduh sama sesuatu hal yang gak pernah gue lakuin!,,,,,,,,,,,,,,,,,,
HS,"Galau? | Iya nih. Abis diputusin pacar | Gw donk ga pernah diputusin | Hebat!! Apa rahasianya? | Ga pernah pacaran, gmana diputusin | ASU!",,,,,,,,,,,,,,,,,,
HS,"Gampangan banget sih jadi orang, baru dipuji dikit aja udah kaya mau ngasih kehormatannya aja haha TOLOL",,,,,,,,,,,,,,,,,,
HS,gangguan pendengaran atau ketulian menyebabkan kesulitan merespon cepat pembicaraan makanya sering disangka dingin banget ke cewek disangka vampir padahal mah budek kaga dengar setengah tuli,,,,,,,,,,,,,,,,,,
HS,Ganteng banget anjir gw menggelepar,,,,,,,,,,,,,,,,,,
HS,gaya lu kunyuk,,,,,,,,,,,,,,,,,,
HS,Gila babi la berat aku dah turun siel,,,,,,,,,,,,,,,,,,
HS,"Gila nih panasnya, sampe nutrisari jeruk amerika idiot ampe keringetan.",,,,,,,,,,,,,,,,,,
HS,"gimana dong goblo banget aku nih main screenshot story ig cowo yang abis sidang skripsi HAHAHA CACA EMANG BEGO BANGET, PANIK ASLI GIMANA INI",,,,,,,,,,,,,,,,,,
HS,"gmw liat dm dr lu ah! udh tau gua nanya tentang apa, bolot",,,,,,,,,,,,,,,,,,
HS,Goblinnya brengsek banget gw ktw ampe pilek,,,,,,,,,,,,,,,,,,
HS,Goblog kok dipelihara,,,,,,,,,,,,,,,,,,
HS,"Goblog sekali, udah lah males liat reportnya kalo begini. Doa aja taun depan juara lagi",,,,,,,,,,,,,,,,,,
HS,"Gosip di buat oleh org iri,di sebarluaskan oleh org bodoh,dan di terima oleh para idiot",,,,,,,,,,,,,,,,,,
HS,"Gosip itu dibuat oleh orang iri, disebarkan oleh orang bodoh, dan diterima oleh orang idiot.",,,,,,,,,,,,,,,,,,
HS,"Gosip itu dibuat oleh orang iri, disebarkan oleh orang bodoh, dan diterima oleh orang idiot",,,,,,,,,,,,,,,,,,
HS,Gpp lah drpd si tabib cabul.. Teriak1 gak karuan sambi ngocok tongkol minta gbr bugil pecun... Hoaalaaaah gak ngebayang ana.. Dasar binatang ,,,,,,,,,,,,,,,,,,
HS,"Grombolan Kadal Jidat gosong,mmg bgtu, sukanya ribut tapi klo grombolanya yang salah pura1 Budek..Dasar Grombolan Cingkrang",,,,,,,,,,,,,,,,,,
HS,"gua benci bgt liat org koar1 spoiler avenger. yaelahhh!!! sblm avenger kluar juga, film1 yang laen digituin juga kaga pada protes. knp br pd protes skrg?!? bacot",,,,,,,,,,,,,,,,,,
HS,Gua berasa jadi orang bejad ya,,,,,,,,,,,,,,,,,,
HS,apa sih da yang kamu harapkan dia kasih perhatian haha inget sama kondisi kamu aja nggak daaa udahlah,,,,,,,,,,,,,,,,,,
HS,kamu yang busuk gt,,,,,,,,,,,,,,,,,,
HS,kamu galak,,,,,,,,,,,,,,,,,,
HS,saya baca ini menitikan air mata disaat warga lombok sangat kesulitan akibat gempa mereka masih sempat gotong royong,,,,,,,,,,,,,,,,,,
HS,aduh kamu stalking y,,,,,,,,,,,,,,,,,,
HS,banci itu beraninya keroyokan emak2 lagi yang dikeroyok astaghfirullahemoga aparat hukum kita punya nyali utk menang,,,,,,,,,,,,,,,,,,
HS,diam diamekarang mungkin kamu mencintainya dalam diam mungkin sekarang bagimu memilikinya adalah ketidakmungkin,,,,,,,,,,,,,,,,,,
HS,buat kamu bukan hanya rindu tapi sampai saat ini cuma aku yang masih bertahan,,,,,,,,,,,,,,,,,,
HS,contoh konten hoax yang nyata aku sayang kamu selamanya sampai kapanpun aku ga bakalan ninggalin kamu dan aku mau menerima,,,,,,,,,,,,,,,,,,
HS,mana itu akun ratnasrempet jangan diam segera klarifikasi itu berita klau kamu dianiaya jangan bohongi masyara,,,,,,,,,,,,,,,,,,
HS,gapantes dikasih kita kita mah apalagi elu,,,,,,,,,,,,,,,,,,
HS,sory mencelah ank ramai pun kalau tak terdidik dgn ilmu agama kat mana anak2 itu boleh bant,,,,,,,,,,,,,,,,,,
HS,dia tidak peduli bencana dia bukan kita,,,,,,,,,,,,,,,,,,
HS,bahasaugi itu buat manusia kerdil sepertimu yang tdk mempunyai tuhan,,,,,,,,,,,,,,,,,,
HS,semoga kita para wanita dijauhkan dari laki laki babi yang suka main fisik kek gini btw ini story temenku miris ba,,,,,,,,,,,,,,,,,,
HS,pemain tak terlibat tapi kena imbas ulah suporternya pasti terpukul apalagi mereka pemimpin klasemen,,,,,,,,,,,,,,,,,,
HS,jelek header kamu ngga ada ganteng gantengnya,,,,,,,,,,,,,,,,,,
HS,aku bingung mt an sama kamu,,,,,,,,,,,,,,,,,,
HS,lapar makan tv led barang elektronik emas baju2 baru punya toko pak kita ambil,,,,,,,,,,,,,,,,,,
HS,engga belum sanggup kehilangan kamu ea eaaa,,,,,,,,,,,,,,,,,,
HS,kalah kamu wkwk,,,,,,,,,,,,,,,,,,
HS,sebenarnya memang tidak bole main,,,,,,,,,,,,,,,,,,
HS,makan nasi sambil ketawa langsung dimarahi sama ibu ayo a kita ke kua agar aku sah menjadi makmum,,,,,,,,,,,,,,,,,,
HS,dan janganlah kamu me,,,,,,,,,,,,,,,,,,
HS,yeol meskipun kita tinggi tapi gaboleh bully yang bantet kasian g,,,,,,,,,,,,,,,,,,
HS,sebenernya mereka percaya akan tuhan ga sih kok setiap ada bencana selalu ngehubungin ke mana mana,,,,,,,,,,,,,,,,,,
HS,ga bakal pak mereka bbc,,,,,,,,,,,,,,,,,,
HS,gak biso liat aku tenang dikit kamu ya,,,,,,,,,,,,,,,,,,
HS,penyebar hoax ujaran kebencian pengedit situasi hanya dipanggil dan ditahan bila pelakunya bukan projo percaya buk,,,,,,,,,,,,,,,,,,
