Label,Tweet,,,,,,,,,,,,,,,,,,
Non_HS,sumpah sesal anjir kayak gue goblok banget percaya cihhh,,,,,,,,,,,,,,,,,,
Non_HS,pakai kacamata bang sipit,,,,,,,,,,,,,,,,,,
Non_HS,puluh ulama jabar nyata dukung jokowi maju pilih presiden 2019,,,,,,,,,,,,,,,,,,
Non_HS,enak ngentot straight,,,,,,,,,,,,,,,,,,
Non_HS,novri sus emil agresif puti santai,,,,,,,,,,,,,,,,,,
Non_HS,ngewe cepat desah doang ngewe knalpot kendara,,,,,,,,,,,,,,,,,,
Non_HS,karyawan depot camat bilah hilir deklarasi anti hoaks amp pilih kepala daerah 2018 damai,,,,,,,,,,,,,,,,,,
Non_HS,perempuan bangsa menang sudirman said ida fauziyah sawer dirman ida sawer jawa,,,,,,,,,,,,,,,,,,
Non_HS,doa rezeki tak putus inna haa zaa larizquna maa lahu min na fadesungguhnya ini ialah pemberian kami kepada kamu ,,,,,,,,,,,,,,,,,,
Non_HS,makasih loh ntar kita bagi hasil aku 99 9 sisanya buat kamu,,,,,,,,,,,,,,,,,,
Non_HS,ya aku akan menjadi satu satunya bukan nomor satu tetapi satu satunya,,,,,,,,,,,,,,,,,,
Non_HS,i dont know why but these zikir sangat membantu aku pon dapat hasil dari orang retweetambil usaha sambil doa insha alla,,,,,,,,,,,,,,,,,,
Non_HS,aah kamu aja mas aku lebih suka diayomi,,,,,,,,,,,,,,,,,,
Non_HS,mau bantu aku nabung,,,,,,,,,,,,,,,,,,
Non_HS,tak peduli seperti apa hidupmu kamu selalu punya pilihan untuk melihat dari sisi baiknya atau sisi buruknya,,,,,,,,,,,,,,,,,,
Non_HS,aku dah tahu macam mana nak bagi pengantin gelak natural hahahahahahahahahahaha,,,,,,,,,,,,,,,,,,
Non_HS,cara nak mintak maaf ada 3 1 aku minta maaf 2 aku mengaku salah aku 3 apa yang boleh aku buat untuk betulkan ba,,,,,,,,,,,,,,,,,,
Non_HS,yuk netweetjen dibantu,,,,,,,,,,,,,,,,,,
Non_HS,ya allah ya tuhanku kau lindungilah kedua ibu bapaku disaat aku berjauhan dengan mereka,,,,,,,,,,,,,,,,,,
Non_HS,giveaway karena hari ini umur aku bertambah jadi aku ingin berbagi rules aja dan ucapkan saya wish dan screenshoot,,,,,,,,,,,,,,,,,,
Non_HS,semoga aku terlindungi dari bahaya ,,,,,,,,,,,,,,,,,,
Non_HS,selamat hari jumat buat kamu yang selalu bikin rindu ini kumat,,,,,,,,,,,,,,,,,,
Non_HS,diremes di enyot ngedusel dusel di kamu wah mantap,,,,,,,,,,,,,,,,,,
Non_HS,hi rakyat2 ku karena akhirnyauga postelca aku mau give away album love yourself answerealed versionnya pilihendiri e,,,,,,,,,,,,,,,,,,
Non_HS,pilih salah satu yang paling kamu nyaman,,,,,,,,,,,,,,,,,,
Non_HS,aku sendiri jugaaa yuk barengan,,,,,,,,,,,,,,,,,,
Non_HS,mini giveaway berhubung aku ultah aku mau bagi rezeki pulsa 10k like aja mau mutualan boleh bgt doain aku yaa diundi,,,,,,,,,,,,,,,,,,
Non_HS,mantan kamu yang itu jangan dilupain justru dijadikan pengingat bahwa kamu pernah salah pilih,,,,,,,,,,,,,,,,,,
Non_HS,aryana tolong bukak mata besar besar pilihlah syafiq biarlah sofea bahagia bersama adrian pls laaaaaaaa murungnya aku kal,,,,,,,,,,,,,,,,,,
Non_HS,buatlah cita cita kamu setinggi bintang di langit tetapi jangan lupa untuk membuat anak tangga perencanaannya cendekia bijak,,,,,,,,,,,,,,,,,,
Non_HS,cantik boleh la confess kat crush peluang kena reject tu senipis sel epidermis bawang je tang aku ni kalau confess hmm,,,,,,,,,,,,,,,,,,
Non_HS,cinta kamu ke aku tuh kyk foto album tau ga,,,,,,,,,,,,,,,,,,
Non_HS,ini yang buat aku semakin yakin indonesia akan damai jika di pimpin beliau,,,,,,,,,,,,,,,,,,
Non_HS,aku nk walk in ajelah senang,,,,,,,,,,,,,,,,,,
Non_HS,jadilah seperti aku,,,,,,,,,,,,,,,,,,
Non_HS,sentiasa ingatkan diri jangan selalu tunjukkan kegembiraan depan orang yang sedang kecewa moga aku sentiasa ingat,,,,,,,,,,,,,,,,,,
Non_HS,temen temen yang ada di jatinangor dan sekitarnya bisa tolong dibeli ya jualan bapak ini beliau jual kain lap keset dsb,,,,,,,,,,,,,,,,,,
Non_HS,hahaa aku juga ga ngerti tadi tapi asal jawab aja,,,,,,,,,,,,,,,,,,
Non_HS,kelak jika aku menjadi orangtua yang akan kulakukan adalah meyakinkan anakku nak percaya sama ayah tidur siang itu,,,,,,,,,,,,,,,,,,
Non_HS,aku terhibur hahahahahahahahahahahaha,,,,,,,,,,,,,,,,,,
Non_HS,okay but the bahasa melayu names for our malaysian birds selalu buat aku mudah terhibur contohnya burung berek ber,,,,,,,,,,,,,,,,,,
Non_HS,iya lucu emang dia aku temenan di ig,,,,,,,,,,,,,,,,,,
Non_HS,lhaa kaann ancene aku arek e kurang pinter wayah e aku koncoan terus yaa ambk arek e sopo ngerti kecipratan rejeki,,,,,,,,,,,,,,,,,,
Non_HS,give away time untuk merayakan ulang tahun namjoon dan ulang tahun aku aku adain give away photocard dan juga album lov,,,,,,,,,,,,,,,,,,
Non_HS,kak mau jugaa,,,,,,,,,,,,,,,,,,
Non_HS,kamu adalah yang ia inginkan untuk menjadi tempat persinggahan terakhirebesar itu harapannya kepadamu jangan mengecew,,,,,,,,,,,,,,,,,,
Non_HS,aku dulu lahir di jogja jogja dijuluki kota berhati nyaman pantes aja aku langsung pake hati kalo udah nyaman dikit,,,,,,,,,,,,,,,,,,
Non_HS,guys aku jumpa ayat yang berguna untuk digunakan time korang tengah putus asa sabar terbahagi kepada dua iaitu sabar,,,,,,,,,,,,,,,,,,
Non_HS,kepada fresh grad yang cari kerja boleh try amalkan zikir dan semua doa ni alhamdulillah lepas amalkan ni aku pon dapat,,,,,,,,,,,,,,,,,,
Non_HS,kalau akhlak mereka lebih baik kenapa engga kalau mereka lebih bisa menghargai melindungi,,,,,,,,,,,,,,,,,,
Non_HS,buat dong aku kan juga istrinya daniel,,,,,,,,,,,,,,,,,,
Non_HS,hihihihi look at the face lepaskan aku taknak kau bau ikan bagi aku mandikan dulu namau nameow catsoftwit,,,,,,,,,,,,,,,,,,
Non_HS,guys today aku nak rekomen kat korang movie2 yang best some of you maybe belum pernah tengok movie tu lagi aku tak berapa pa,,,,,,,,,,,,,,,,,,
Non_HS,tolong la harini je dah banyak sangat ketawa krem perut aku yall,,,,,,,,,,,,,,,,,,
Non_HS,gt tuhan yesus berkata 'aku dapat menggantikan rasa frustasi di hatimu dengan damai sejahtera mbml,,,,,,,,,,,,,,,,,,
Non_HS,aku doakan lelaki yang tengah kerja cari duit untuk pasangan masing masing diberikan kesihatan dan dimurahkan rezekiemo,,,,,,,,,,,,,,,,,,
Non_HS,tolong dibeli ya jualan bapak ini,,,,,,,,,,,,,,,,,,
Non_HS,bersyukah hingga kamu lupa rasanya kekurangan tulisanirin jumatberkah,,,,,,,,,,,,,,,,,,
Non_HS,segitu kangennya ya mba sama aku,,,,,,,,,,,,,,,,,,
Non_HS,hidup ini adalah pilihan yang harus kamu pilih,,,,,,,,,,,,,,,,,,
Non_HS,if si keli tu boleh jadi femes apantah lagi aku kan kahkahkah,,,,,,,,,,,,,,,,,,
Non_HS,sayang lagi sakit jadi aku harus sentiasa ada buat sayangku,,,,,,,,,,,,,,,,,,
Non_HS,i liked a video aku tanya pak jokowi pakai bahasa jawa,,,,,,,,,,,,,,,,,,
Non_HS,okaay nggapapaa aku minta doyoung ajaa makasih yaa,,,,,,,,,,,,,,,,,,
Non_HS,aku terima nikahnya dengan mas kahwin bacaanurah al fatihah dear future wife nanti kita kahwin saya sedekahkan al fat,,,,,,,,,,,,,,,,,,
Non_HS,le makan samyang yuk aku udh lama ga makan samyang udh lama juga ga disayang,,,,,,,,,,,,,,,,,,
Non_HS,pegi kedai bawak lah adik aku teman pastu uncle tu tanya ni anak you ke muka sama hahaha muka aku macam orang dah kawin ke doh,,,,,,,,,,,,,,,,,,
Non_HS,aku suka mie sedap kalau di tumis ulang pake bawang merah bawang putih telor daun bawang irisan ca,,,,,,,,,,,,,,,,,,
Non_HS,jika aku jadi ratumu maka pasti kau rajanya ya kan,,,,,,,,,,,,,,,,,,
Non_HS,aku penggemar mie burung dara enaknya nyambung terus,,,,,,,,,,,,,,,,,,
Non_HS,ni kalau suami aku panggil sayang macam ni we're gonna make babies right after,,,,,,,,,,,,,,,,,,
Non_HS,be strong bro,,,,,,,,,,,,,,,,,,
Non_HS,di antara buku buku kesukaan yang kaubaca sampai malam kian jauh dan sendiri aku ingin jadi buku yang menelungkup,,,,,,,,,,,,,,,,,,
Non_HS,cerita hari ini aku baru beli 2 hamster biar ngga kesepian aja sih di rumah aku pandaaaang terus mereka berdu,,,,,,,,,,,,,,,,,,
Non_HS,tak perlu takut untuk meninggalkan sesuatu yang tidak menghormatimu masih banyak kesempatan untukmu menjadi lebih terhormat jika kamu berani,,,,,,,,,,,,,,,,,,
Non_HS,let me make this clear paan dalam hidup ni kan kalau kita merasa gagal kita akan ada motivasi,,,,,,,,,,,,,,,,,,
Non_HS,ya allah aku berlindung kepada mu dari siksa kubur dari siksa neraka jahannam dari fitnah hidup dan mati dan dari f,,,,,,,,,,,,,,,,,,
Non_HS,kuis lagi kuis lagi emang daihatsu baik banget yaahabat bagi bagi hadiah pulsa terus kuis kali ini kamu harus menebak,,,,,,,,,,,,,,,,,,
Non_HS,stay beside you was my job hehee sayang kamu,,,,,,,,,,,,,,,,,,
Non_HS,hahahahaha terhibur betul lah lol semua tempat dia tiful kan ingat ke aku sorang je perasan typo dekat caption tu,,,,,,,,,,,,,,,,,,
Non_HS,fams sama aku yuk,,,,,,,,,,,,,,,,,,
Non_HS,aku cuba nak amalkan sikap pergi mampus tapi sayang aku gagal sebab aku jenis mudah kesian dan mudah memaafkan,,,,,,,,,,,,,,,,,,
Non_HS,wkwkwk gt lt berdoa aja kamu lip yang banyak semoga ganteng wowognya,,,,,,,,,,,,,,,,,,
Non_HS,udah tau ikon dari jaman win yang aku suka pertama itu taehyun terus suka yunhyeong aku dukung ti,,,,,,,,,,,,,,,,,,
Non_HS,gilaaa beliin aku dong kak,,,,,,,,,,,,,,,,,,
Non_HS,kalau kamu mau dihormati harus mau menghormati,,,,,,,,,,,,,,,,,,
Non_HS,tolong lah setiap hari tu sebelum tidur tanya diri sendiri dan self reflect perangai babi sampah apa ye aku buat harini,,,,,,,,,,,,,,,,,,
Non_HS,bibi adikku si cantik suka banget liatnya kalau kamu lagi seneng enggak tau kenapa jadi ikutan seneng bi pos,,,,,,,,,,,,,,,,,,
Non_HS,aku ikut habib lutfi aja rois aam jam'iyyah ahlith thariqah al mu'tabarah an nahdliyyah yang meminta menurunkan bendera,,,,,,,,,,,,,,,,,,
Non_HS,omg kamu harus melihat ini bigolive,,,,,,,,,,,,,,,,,,
Non_HS,jadi dirimu sendiri agar ketika seseorang mencintai kamu tak perlu takut jika dia akan temukan dirimu bukan orang,,,,,,,,,,,,,,,,,,
Non_HS,saat ditanya aku hanya diam dan mengangguk kutahu bahwa dia orang yang baik,,,,,,,,,,,,,,,,,,
Non_HS,aku pake himalaya neem mask juga gini kok bagus emg matull banget,,,,,,,,,,,,,,,,,,
Non_HS,selalu buat macam ni setiap kali nampak peti ais kat dapur haha,,,,,,,,,,,,,,,,,,
Non_HS,idola aku banget itu mba,,,,,,,,,,,,,,,,,,
Non_HS,sesungguhnya penguasaan diri adalah penanda dari kedewasaan seseorangelamat buat kamu yang memang benar benar sudah b,,,,,,,,,,,,,,,,,,
Non_HS,hahahaha pastu buat2 terkejut eh dah sampai aku tumbokk muka kau kang,,,,,,,,,,,,,,,,,,
Non_HS,karena presentasi hari ini lancar aku mau bikin ga album only wanna ver one ver aja no need to follow tapi,,,,,,,,,,,,,,,,,,
Non_HS,shopee kamu apaa mau dong,,,,,,,,,,,,,,,,,,
Non_HS,laksanakan segala apa yang diwajibkan allah niscaya kamu menjadi orang yang paling bertakwa hr ath thabrani,,,,,,,,,,,,,,,,,,
Non_HS,aku cinta segala promo grabfood karena bisa makan burger mcd seharga ayam geprek,,,,,,,,,,,,,,,,,,
Non_HS,aku mungkin luaran nampak happy go lucky sentiasa tersenyum dgn orang sekeliling friendly gelak ketawa sampai berdekah a,,,,,,,,,,,,,,,,,,
Non_HS,aku cinta w1,,,,,,,,,,,,,,,,,,
Non_HS,done watching dilan 1990 2018 dari start movie sampai habis aku senyum sorang nasib baik tengok sengsorang kalau ram,,,,,,,,,,,,,,,,,,
Non_HS,aku mau,,,,,,,,,,,,,,,,,,
Non_HS,doa untuk ibu dan bapa ya allah ampunila,,,,,,,,,,,,,,,,,,
Non_HS,tampil sndiri atasi diri hadapi audiens lakuin perlihatkan ssuatu 'skill mu sampai tuntas buat smua kagum p,,,,,,,,,,,,,,,,,,
Non_HS,ciri lelaki idaman aku um kena sama macam ayah aku,,,,,,,,,,,,,,,,,,
Non_HS,sikaaat ajaaaa sissst sikat bajunya celananya biar bersih wkwk canda ding kalo bisa ga usah sikat sii,,,,,,,,,,,,,,,,,,
Non_HS,shuhuaama sih tapi aku suka banget sama makanan jepang,,,,,,,,,,,,,,,,,,
Non_HS,aku pun nak cari rezeki halal bisnes online dgn cara betul takkan aku nak menipu orang pulak kan,,,,,,,,,,,,,,,,,,
Non_HS,cepet sembuh sayaang semoga kamu selalu diberikan kekuatan dan allah angkat sakit kamu segera ya semangat ya,,,,,,,,,,,,,,,,,,
Non_HS,selamat bertambah umur kamuu semoga kamu sehat selalu dan dipanjangkan umurmu semoga kamu selalu sehat,,,,,,,,,,,,,,,,,,
Non_HS,wei aku kt kedai mamak ni tiba2 keluar nudes kt tl aduh hahahaha,,,,,,,,,,,,,,,,,,
Non_HS,walaupun maut memisahkan kita aku akan selalu mencintaimu menyayangimu setulus hatiku fellychibi,,,,,,,,,,,,,,,,,,
Non_HS,hari ini aku akan berusaha untuk bersinar dengan awan berjalan beriringan dan tetap memuja kebebasan hanyutku,,,,,,,,,,,,,,,,,,
Non_HS,rindu kau tapi takpa la aku doa dari jauh jeemoga tuhan beri perlindungan pada kau,,,,,,,,,,,,,,,,,,
Non_HS,mantap nih kata kata pak jokowi aku dan para avengers lain siap untuk mencegah thanos menghapus setengah dari populasi j,,,,,,,,,,,,,,,,,,
Non_HS,anak jiran aku umur 3 tahun bagi tau,,,,,,,,,,,,,,,,,,
Non_HS,muhammad q muhammad q dengarkanlah seruanku aku rindu aku rindu padamu muhammad,,,,,,,,,,,,,,,,,,
Non_HS,jangan lupa sholat jumat ya sayang aku jelek ya sayang ' bukan biar ganteng ih itu kan wajib oh kirain makasi,,,,,,,,,,,,,,,,,,
Non_HS,seseorang yang bisa membuat aku sering merasa khawatir berarti dialah orang yang sangat aku sayang,,,,,,,,,,,,,,,,,,
Non_HS,mari berdoa agar sukses kawan kawan,,,,,,,,,,,,,,,,,,
Non_HS,ini yang namanya indonesia ini yang namanya toleransi ini yang namanya bhineka tunggal ika peti jenasah pendeta oma palese man,,,,,,,,,,,,,,,,,,
Non_HS,aku mauuuu,,,,,,,,,,,,,,,,,,
Non_HS,omg kamu harus melihat ini bigolive gt pada kemana aja,,,,,,,,,,,,,,,,,,
Non_HS,ngikik baca ginian siang hari,,,,,,,,,,,,,,,,,,
Non_HS,wahai manusia yang aku suka terima kasih sebab support aku serta ada ketika aku gembira dan duka kau memang anugerah,,,,,,,,,,,,,,,,,,
Non_HS,lipstik yang creamy kaya purbasari gt bibir aku kering kalo pake itu enak ga keliatan kering,,,,,,,,,,,,,,,,,,
Non_HS,gemes kan aku oenyoe getoh cmiew jfclosedday,,,,,,,,,,,,,,,,,,
Non_HS,gua dinyanyiin raisa lagunya mantan terindah ya allah aku terharu,,,,,,,,,,,,,,,,,,
Non_HS,kenangan yang paling indah itu ialah ketika pertama kali kau cumbui aku sayang,,,,,,,,,,,,,,,,,,
Non_HS,teruntuk kamu yang sabar ya,,,,,,,,,,,,,,,,,,
Non_HS,terus dia sharing2 gitu deh sama ngasih motivasi gua sama ngasih petuah2 kalo kamu pgn kaya amp nikah di umur sebelum 30th,,,,,,,,,,,,,,,,,,
Non_HS,belum start kuliah aku dah ponteng haih apa nak jadi hahaha,,,,,,,,,,,,,,,,,,
Non_HS,iya tp ada lagi tempat paling indah aku mau tunjukkin ke km dgn semangataya bawa dia ke tempat titik favorit saya,,,,,,,,,,,,,,,,,,
Non_HS,kalau aku berjuang trus sampai akhir aku pasti akan menemukan jalannya matsukaze tenma,,,,,,,,,,,,,,,,,,
Non_HS,hsjsjs aku juga apalagi kalo diliat dancenya,,,,,,,,,,,,,,,,,,
Non_HS,selamat berehat mr acappan antara pelawak aku suka amp evergreen selainathiya,,,,,,,,,,,,,,,,,,
Non_HS,senang senang je aku diperbodohkan duluob sob,,,,,,,,,,,,,,,,,,
Non_HS,ngantuk aku tidur dulu,,,,,,,,,,,,,,,,,,
Non_HS,mauu dm aku,,,,,,,,,,,,,,,,,,
Non_HS,karena aku percaya allah sudah mentakd,,,,,,,,,,,,,,,,,,
Non_HS,iya bener hahaha aku uda folback wlpun jarang pake ig hahaha fbmu apa,,,,,,,,,,,,,,,,,,
Non_HS,jeffan jangan manis manis banget donk nanti aku diabetes,,,,,,,,,,,,,,,,,,
Non_HS,aku cinta diriku sendiri,,,,,,,,,,,,,,,,,,
Non_HS,gigih nau,,,,,,,,,,,,,,,,,,
Non_HS,thanks wey sebab kau berani lagi tegur aku walaupun aku dah tak suke,,,,,,,,,,,,,,,,,,
Non_HS,aku berada ditempat dimana aku bisa menjadi seseorang yang berjalan diatas kakinya sendiri aku berada ditempat dimana aku,,,,,,,,,,,,,,,,,,
Non_HS,aku suka perempuan yang susah nak dapat tapi tulah susah betul nak dapat,,,,,,,,,,,,,,,,,,
Non_HS,aku suka jinkook,,,,,,,,,,,,,,,,,,
Non_HS,aku tahu kau boleh sabar,,,,,,,,,,,,,,,,,,
Non_HS,aku sumpah cheese ni penyelesaian segala masalah kat malaysia nak kedai makan laris jual makanan dengan cheese nak,,,,,,,,,,,,,,,,,,
Non_HS,jika aku bisa memutar kembali waktu aku tidak akan memutarnya karena aku tau kamu sudah bahagia dan beginilah seharusnya,,,,,,,,,,,,,,,,,,
Non_HS,berarti aku sepecial,,,,,,,,,,,,,,,,,,
Non_HS,aku pesan benda penting ini,,,,,,,,,,,,,,,,,,
Non_HS,aku pernah tengok mak bahagia sebahagia dia hidup dengan pakcik mak yang dulunya sedih susah dah mule ade sinar bah,,,,,,,,,,,,,,,,,,
Non_HS,gua dinyanyiin raisa,,,,,,,,,,,,,,,,,,
Non_HS,kok aku minat yang 20 ya pen nonton magic kaito berapaan,,,,,,,,,,,,,,,,,,
Non_HS,tiap salam buat suami aku exo di korea paaak,,,,,,,,,,,,,,,,,,
Non_HS,sesungguhnya penguasaan diri adalah penanda dari kedewasaan seseorang,,,,,,,,,,,,,,,,,,
Non_HS,temen doakan aku ya biar bisa dilancarkan buat ngerjain skripsi terutama bulan ini,,,,,,,,,,,,,,,,,,
Non_HS,kalau kamu dihormati harus mau menghormati,,,,,,,,,,,,,,,,,,
Non_HS,ambik aku pls hahahahaha,,,,,,,,,,,,,,,,,,
Non_HS,aku di bilang akun bisyar receh katanya iya gpp kok klo yang berasa highclass seh beda ya di senyumin aja,,,,,,,,,,,,,,,,,,
Non_HS,ya tuhanku jadikanlah negeri ini mekah negeri yang aman dan jauhkanlah aku beserta anak cucuku daripada menyem,,,,,,,,,,,,,,,,,,
Non_HS,siang happy friday sholat jum'at nya jangan lupa ya aku habis ada kegiatan terus nanti ada latihan bareng team j s,,,,,,,,,,,,,,,,,,
Non_HS,aku syang kamu martinricaardo dan kamu donimodali1olehyakub,,,,,,,,,,,,,,,,,,
Non_HS,uhan dalam tidurku malam ini aku mohon engkau siapkan rezeki surprise yang bagus untukku esok hari aamiin,,,,,,,,,,,,,,,,,,
Non_HS,adek tingkatmu kocak ae rek ngekek aku,,,,,,,,,,,,,,,,,,
Non_HS,aku jokowilagi,,,,,,,,,,,,,,,,,,
Non_HS,terkenal orang itu,,,,,,,,,,,,,,,,,,
Non_HS,aku nk bantu dia slagi aku mampu,,,,,,,,,,,,,,,,,,
Non_HS,kamu belum tentu lebih baik darinya dia belum tentu lebih baik darimu di balik fakta siapa lebih kaya secara materi le,,,,,,,,,,,,,,,,,,
Non_HS,siang boss qu jgn lupa makan siang dan selalu pentingin kesehatan kamu yaemangat untuk perfom nya nanti ya,,,,,,,,,,,,,,,,,,
Non_HS,anak teman aku umur 3 tahun,,,,,,,,,,,,,,,,,,
Non_HS,boleh tak aku nak cakap yang aku dah minat drama korea hahahha sial lah hahahaha,,,,,,,,,,,,,,,,,,
Non_HS,sesungguhnya aku hanya tinggal bersabar dan mematuhi nasihat baik kebaikan yang kulakukan adalah untukku,,,,,,,,,,,,,,,,,,
Non_HS,gag aku mah baik,,,,,,,,,,,,,,,,,,
Non_HS,bwahahah aku sih pasti beli dua cuma ya mengingat harus beli albumnya beli phy juga qu bisa apa qaqa,,,,,,,,,,,,,,,,,,
Non_HS,luvluv teman aku yang kordes,,,,,,,,,,,,,,,,,,
Non_HS,aku cuba nak amalkan,,,,,,,,,,,,,,,,,,
Non_HS,acara keren enterpreneurchool 2018 yang diadain sama ini wajib kamu datengin deh intelektual muda apalagi,,,,,,,,,,,,,,,,,,
Non_HS,andai pun kita menyerah dan berkata sudah kau dan aku adalah kita yang terindah,,,,,,,,,,,,,,,,,,
Non_HS,jangan bersedih brader,,,,,,,,,,,,,,,,,,
Non_HS,pintar itu harus beradab klo hanya pintar aja iblis juga pintar apakah anda juga iblis aku lebih,,,,,,,,,,,,,,,,,,
Non_HS,jangan percaya dengan apa yang sedang kamu baca termasuk tweet ini ingin ngakak sendiri saat nulis ini,,,,,,,,,,,,,,,,,,
Non_HS,awalnya mereka mentertawai apa yang kamu ciptakan lalu mereka mengikuti apa yang kamu ciptakan selanjutnya mereka bangga dg,,,,,,,,,,,,,,,,,,
Non_HS,anak jiran aku umur 3 tahun tau hahahahahaahahaha,,,,,,,,,,,,,,,,,,
Non_HS,yang tau aku ya cuma aku sendiri sama tuhan jadi jangan pernah ngejudge seenaknya,,,,,,,,,,,,,,,,,,
Non_HS,aku yang baik,,,,,,,,,,,,,,,,,,
Non_HS,saya suka video aku tanya pak jokowi pakai bahasa jawa,,,,,,,,,,,,,,,,,,
Non_HS,al quran is the answer for everything that happens in this world termasuk alam semesta ini gimanaetiap permasala,,,,,,,,,,,,,,,,,,
Non_HS,aku teringat ke hehe,,,,,,,,,,,,,,,,,,
Non_HS,ya allah aku berlindung kepada mu dari siksa kubur dari siksa neraka jahannam dari fitnah hidup dan mati,,,,,,,,,,,,,,,,,,
Non_HS,akan ada masa dimana kamu yang dulunya selalu ngasih kabar ke orang tua dengan ucapan sprti ini ma pak uang anakmu habis,,,,,,,,,,,,,,,,,,
Non_HS,suami pun dah macamherlock nak kena berfikir bagai utk dapat jawapan power haha,,,,,,,,,,,,,,,,,,
Non_HS,tuhan bijakkanlah aku dalam mengkhawatirkan masa depanku agar aku tak melumpuhkan masa kini ku,,,,,,,,,,,,,,,,,,
Non_HS,aku tak power mana pun masak memasak nie tapi aku harap bila dah kawin nanti setiap hari aku dapat masakkan suami aku,,,,,,,,,,,,,,,,,,
Non_HS,aku tak akan menarik kembali kata kataku karena itulah jalan ninjaku,,,,,,,,,,,,,,,,,,
Non_HS,jika kamu ingin melupakan rasa marah terhadap seseorang ingatlah kebaikannya,,,,,,,,,,,,,,,,,,
Non_HS,pertama kalinya ada yang ngadain ga sekaligus 2x baik bgt kakanya terhura aku,,,,,,,,,,,,,,,,,,
Non_HS,aku lebih mencintai orang yang menegurku daripada orang yang memujiku kerana orang yang menegurku sebenarnya menyelama,,,,,,,,,,,,,,,,,,
Non_HS,kalo dia anggap kamu sahabat mau semarah apapun dia gak akan bisa benci lama lama pasti balik lagi,,,,,,,,,,,,,,,,,,
Non_HS,bukan nak kata aku ni berani tapi kita tak boleh takut sangat dengan benda ni kita kena takut dengan allah je tapi ke,,,,,,,,,,,,,,,,,,
Non_HS,aku merasakan sebuah pencerahan hari ini,,,,,,,,,,,,,,,,,,
Non_HS,aku terhibur dendangan si ikan kaloi td talented huwaaaa,,,,,,,,,,,,,,,,,,
Non_HS,haha mau ketawa ngakak di depan muka kamu boleh gasih,,,,,,,,,,,,,,,,,,
Non_HS,aku mulai mendewasakan cinta membiarkan kata katamu amarahmu egoismu keras kepalamu lepas dari tubuhmuedangkan aku,,,,,,,,,,,,,,,,,,
Non_HS,malu ah keliatan menel aku wkwkwkwkwk,,,,,,,,,,,,,,,,,,
Non_HS,terserah sampeyan mau bilang apa tapi aku manut habib luthfi dan khryarif rahmat bahwa bendera yang dimaksud dngn liwa dan,,,,,,,,,,,,,,,,,,
Non_HS,iya kamu dari bali yaekalian mutualan yuk aku juga dari bali,,,,,,,,,,,,,,,,,,
Non_HS,iya iya aku jg brcanda yang td wkwk,,,,,,,,,,,,,,,,,,
Non_HS,ada aku,,,,,,,,,,,,,,,,,,
Non_HS,yang aku butuh interaksi dari 95l 99l yuk yang line segitu kuy mutualan nanti ku follow tapi auto followback ok rt aja,,,,,,,,,,,,,,,,,,
Non_HS,aku suka lovitta amp aliqa,,,,,,,,,,,,,,,,,,
Non_HS,ini yang namanya indonesia ini yang namanya toleransi ini yang namanya bhineka tunggal ika,,,,,,,,,,,,,,,,,,
Non_HS,senangnya aku klo km ajak ke sana,,,,,,,,,,,,,,,,,,
Non_HS,ya allah ya tuhanku kau lindungilah diriku,,,,,,,,,,,,,,,,,,
Non_HS,angeline miss katae mama aku cuma dapet dikit sincia'an kemaren me dapet berapa her 12 juta katae kembali menguc,,,,,,,,,,,,,,,,,,
Non_HS,mu gemes banget adminnya aku ga jadi marah,,,,,,,,,,,,,,,,,,
Non_HS,karna sekarang aku lagi ulang tahun dan besok hari enip nya ikon aku bakal adain ga pulsa 10k untuk 2 orang cukup aj,,,,,,,,,,,,,,,,,,
Non_HS,kalo aku yang menang jajanin ya wkwk,,,,,,,,,,,,,,,,,,
Non_HS,aku pernah gak buat gini tapi apesal tak baik baik jugak hahahahawau,,,,,,,,,,,,,,,,,,
Non_HS,seseorang yang berarti tak akan dengan mudah kamu miliki jika kamu sungguh mencintai jangan pernah berhenti berusaha untuk hati,,,,,,,,,,,,,,,,,,
Non_HS,kalau itu mah aku juga ngerti atuh,,,,,,,,,,,,,,,,,,
Non_HS,kehidupan adalah 10 yang terjadi pada dirimu dan 90 sisanya adalah bagaimana kamu menghadapinya,,,,,,,,,,,,,,,,,,
Non_HS,ho meta aku ws mg ahhahahah,,,,,,,,,,,,,,,,,,
Non_HS,kamu dulu hehe,,,,,,,,,,,,,,,,,,
Non_HS,aku tahu didepanku banyak halangan dan rintangan tapi aku tak akan berhenti dan menyerah,,,,,,,,,,,,,,,,,,
Non_HS,nasib baik akak aku normal,,,,,,,,,,,,,,,,,,
Non_HS,hahahaha kamu ya klo ada ice cream nyium aja deh besok aja ya imo jemput mau klo hari ini imo mau pacaran dulu,,,,,,,,,,,,,,,,,,
Non_HS,lah kan emang cantik dek masa iya ganteng kalo kamu ganteng trs gua apaan dek,,,,,,,,,,,,,,,,,,
Non_HS,wow aku salute org yang ada kesabaran yang tinggi niiiii huhuhu,,,,,,,,,,,,,,,,,,
Non_HS,kalo di surabaya liat cece cece ngomong kayak anak jaksel tapi logat e suroboyo gyettt be like lah ya ntik gua pick up,,,,,,,,,,,,,,,,,,
Non_HS,ehh nakk haha aku kdg ngam2 cantik kdg tu ter jauh plak smpai kene bukak seatbelt nak hulur keluar haha,,,,,,,,,,,,,,,,,,
Non_HS,jangan terburu buru mengartikan segala yang baru kamu lihat dari permukaan segala yang tampak belum tentu sesuai letak 9996,,,,,,,,,,,,,,,,,,
Non_HS,tls followan ama aku yukk rep rt kita temenan,,,,,,,,,,,,,,,,,,
Non_HS,tuhan memang mentakdirkan kita untuk saling berjauhan tetapi aku yakin tuhan memiliki rencana besar dibalik itu semua,,,,,,,,,,,,,,,,,,
Non_HS,dengan tata ruangan yang bikin kamu nyaman deh buat nongkrong,,,,,,,,,,,,,,,,,,
Non_HS,sentaknya terdiam akan bungkusan mie yang ia lihat guys lihat deh aku dapet apa kocak banget gak sih l,,,,,,,,,,,,,,,,,,
Non_HS,kamu tidak perlu menjadi bulan atau bintang untuk terlihat sempurna karena menjadi dirimu sendiri adalah sebuah kesempurnaan,,,,,,,,,,,,,,,,,,
Non_HS,hahahah agree nak mengadu itu ini panggil awak saya selalu whatsapp hmmm pastu kite marah kite,,,,,,,,,,,,,,,,,,
Non_HS,nampak sgt aku tidak ada life hahahaha,,,,,,,,,,,,,,,,,,
Non_HS,pak aku pengen nikah pak nduk nikah kue ibadah ojo kesusu ndak ra khusuk nduk paaak,,,,,,,,,,,,,,,,,,
Non_HS,aku jumpa ayat yang berguna,,,,,,,,,,,,,,,,,,
Non_HS,ana uhibbuki fillah hatta fil jannah abadan abada aku mencintaimu hingga ke syurga selama lamanya kerana allah,,,,,,,,,,,,,,,,,,
Non_HS,mau daftar jadi driver ojol,,,,,,,,,,,,,,,,,,
Non_HS,doa rezeki tak putus inna haa zaa larizquna maa lahu min na fadesungguhnya ini ialah pemberian kami kepada kamu pember,,,,,,,,,,,,,,,,,,
Non_HS,aku doakan lelaki yang tengah kerja cari duit untuk pasangan masing masing diberikan kesihatan dan dimurahkan rezeki mu,,,,,,,,,,,,,,,,,,
Non_HS,happy videogameday untuk seluruh gamers dimanapun kamu berada semoga engga cuman main game,,,,,,,,,,,,,,,,,,
Non_HS,setuju deh sama kamu,,,,,,,,,,,,,,,,,,
Non_HS,moga baik2 saja n dapat baby comel,,,,,,,,,,,,,,,,,,
Non_HS,yuk intip gaya busana julie laiskodat ini bisa jadi refrensi kamu ke kondangan lewat,,,,,,,,,,,,,,,,,,
Non_HS,aku mohon tepatilah janjimu penantiancintaeps19,,,,,,,,,,,,,,,,,,
Non_HS,aku akan bertahan selagi aku bisa namun disaat aku sudah tak bisa dan tak kuat bertahan maka aku akan pergi dan menjauh,,,,,,,,,,,,,,,,,,
Non_HS,wkwkwk ketawa aku kalo sedaerah sekalian meet up deh g,,,,,,,,,,,,,,,,,,
Non_HS,ocit kangen banget ini aku irene dapet acc dari temen dan mau balik rpw,,,,,,,,,,,,,,,,,,
Non_HS,hayuk mas aku mau,,,,,,,,,,,,,,,,,,
